0,mens indian clothing online,2016-04-27 21:44:18,men why are indian ,com.br,en,google, {'neg': 0.0, 'neu': 1.0, 'pos': 0.0, 'compound': 0.0}
1,men's indian chief costume,2016-04-27 21:44:18,men why are indian ,com.br,en,google, {'neg': 0.0, 'neu': 1.0, 'pos': 0.0, 'compound': 0.0}
2,mens indian sandals,2016-04-27 21:44:18,men why are indian ,com.br,en,google, {'neg': 0.0, 'neu': 1.0, 'pos': 0.0, 'compound': 0.0}
0,mens indian clothing online,2016-04-27 21:44:18,men are why indian ,com.br,en,google, {'neg': 0.0, 'neu': 1.0, 'pos': 0.0, 'compound': 0.0}
1,men's indian chief costume,2016-04-27 21:44:18,men are why indian ,com.br,en,google, {'neg': 0.0, 'neu': 1.0, 'pos': 0.0, 'compound': 0.0}
2,mens indian sandals,2016-04-27 21:44:18,men are why indian ,com.br,en,google, {'neg': 0.0, 'neu': 1.0, 'pos': 0.0, 'compound': 0.0}
